03-Jan-12,Security,SE Capital WiP,Security Services Group,1025852,26917.24,Replacing the Infra Red intruder beams at King George V flood gate.,SN6 8LA,,30148048,IMTH001252,Administration
24-Jan-12,Security,SE Kent & South London- Tidal Flood Risk Manager,MITIE Security London Ltd,1034182,75084.10,Security Guard Services at Thames Barrier and Associated Sites 16 July 2011 to 13 July 2012,E1W 1XY,,30239724,,Administration
17-Jan-12,Staff Childcare,HR Strategy,Edenred Childcare Vouchers Ltd,1030379,207256.50,"Childcare Assistance Service Charges. This money is reclaimed through Salary Sacrifice from the employee, cost neutral scheme.",SW1V 2RS,,,,Administration
03-Jan-12,Staff Medical Care,Internal Transformation (HSW),Health Management Ltd,1028042,36678.90,Provision of Occupational Health services until end of March 2012 ,BN8 5NN,,,HOHRITA001,administration
03-Jan-12,Staff Medical Care,Internal Transformation (HSW),Health Management Ltd,1028053,40752.00,Provision of Occupational Health services until end of March 2012 ,BN8 5NN,,,HOHRITA001,administration
03-Jan-12,Staff Training & Development,Incident Management Manager,RAB Consultants Ltd,1025598,29864.94,Incident Management Training and Exercise project ,WS13 6QG,,30200828,FCPIM00039B00,administration
19-Jan-12,Staff Training & Development,Incident Management Manager,RAB Consultants Ltd,1032657,32138.72,Incident Management Training and Exercise project ,WS13 6QG,,30200828,FCPIM00039B00,administration
24-Jan-12,Systems Delivery,CI Solutions Delivery Management,Infoterra Ltd,1028735,70977.60,Milestones - Data Sharing INSPIRE Obligation Enhancements,GU14 0NL,,,BBPDM20000L39,Project
19-Jan-12,Systems Delivery,HO Capital WiP,HR Wallingford Ltd,1031426,28800.00,Modelling and Decision Support Framework tool Deployment Support.,OX10 8BA,,,FCPIF00088L01,Project
03-Jan-12,Systems Delivery | Maintenance & Support,CIS Capital WiP,CDC Climat,1027673,30000.00,ETSWAP (Aviation Industry registration tool for EU Emissions Trading Scheme) Module 2,"16 Rue Berthollet 94110 Arcueil, France",,,CIS3309115,Project
03-Jan-12,Systems Delivery | Maintenance & Support,CIS Capital WiP,CDC Climat,1027677,40000.00,ETSWAP  (Aviation Industry registration tool for EU Emissions Trading Scheme) Support costs associated with Module 1 from 17 December 2010 to 31 March 2011 as per the approved ETSWAP Work Order dated 1 July 2010.,"16 Rue Berthollet 94110 Arcueil, France",,,CIS3309115,Project
10-Jan-12,Systems Delivery | Managed/Outsource Services | Hardware | Telecoms | Software,HO Flood Warning Systems | HO Capital WiP | HO Met Office Joint Venture Manager | CI Solutions Delivery Management | CI SD Management MRA | CI ITXpress Business | CI SP MRA | National Accomodation Change Fund | CIS Capital WiP,Capgemini UK Plc,1029673,6981893.24,IT Service Procurement Outsource service charge and work order costs,SW8 2HG,,30259319 | 30259316 | 30282611 | 30304723 | 30295016 | 30259320, | FCPMM00050L03 | HOOP000105 | BBXXX20002L03 | EBCRI11502L01 | CIS111923 |  | CIS3302972 | HORES00053 | HORES00073 |  | CIS330352 | HORES00091 | CIS161238 | HORES00104 |  | HORES00105 | BBPDM20000L13 |  | BBPDM20021L01 | ,Project / Administration
19-Jan-12,Telecoms,HO Flood Warning Systems,MM Teleperformance Ltd,1032631,62477.24,Call centre and managment costs for Floodline ,BS2 8QY ,,30146474,,administration
17-Jan-12,Vehicle Maintenance,HO Marine Monitoring Service,Briggs Marine Contractors Ltd,1023889,26734.06,"Annual Maintenance and Repairs, Adhoc Services and Excessive Wear Items",KY3 9AX ,,30277423,,administration
12-Jan-12,Vehicle Maintenance,HO Fleet Operations,Briggs Marine Contractors Ltd,1030205,198723.79,Boat Maintenance 2011/2012,KY3 9AX ,,30277423,HORES00015,administration
17-Jan-12,Vehicle Maintenance,HO Fleet - EA Wales,Hitachi Capital Commercial Vehicle Services,1033158,31275.52,Commercial Vehicle Maintenance 01.04.11 to 31.3.12,BA14 8QU,,40018959,,administration
24-Jan-12,Vehicle Maintenance,HO Fleet Operations,Hitachi Capital Commercial Vehicle Services,1033226,25935.21,Commercial Vehicle Maintenance 2011/2012,BA14 8QU,,30182247,,administration
24-Jan-12,Vehicle Maintenance,HO Fleet Operations,Hitachi Capital Commercial Vehicle Services,1033245,196574.10,Commercial Vehicle Maintenance 2011/2012,BA14 8QU,,30182247,,administration
