Department,Entity,Date,Expense Type,Expense Area,Supplier ,Transaction Number,Amount,Description,Supplier Postcode,Supplier Type,Contract Number,Project Code,Expenditure Type,Vat Registration Num
Defra,EA,04/04/2013,Fleet,WA Capital WiP,Mitsubishi Motors,1170973,"£25,297.06","Vehicle Purchase - Commercial Vehicles - Light & Medium Duty 4x4s (Mitsubishi) part of annual fleet asset replacement programme. This is to ensure we operate assets that are both cost effective, safe and legal to use under the PUWER regulations. (provision and use of work equipment regulations)",,GL7 1LF,,40036477,HOFRMWA006,Project
Defra,EA,04/04/2013,Fleet,WA Capital WiP,Mitsubishi Motors,1170979,"£25,338.02","Vehicle Purchase - Commercial Vehicles - Light & Medium Duty 4x4s (Mitsubishi) part of annual fleet asset replacement programme. This is to ensure we operate assets that are both cost effective, safe and legal to use under the PUWER regulations. (provision and use of work equipment regulations)",,GL7 1LF,,40036477,HOFRMWRWA1,Project
Defra,EA,04/04/2013,Fleet,WA Capital WiP,Mitsubishi Motors,1170984,"£25,338.02","Vehicle Purchase - Commercial Vehicles - Light & Medium Duty 4x4s (Mitsubishi) part of annual fleet asset replacement programme. This is to ensure we operate assets that are both cost effective, safe and legal to use under the PUWER regulations. (provision and use of work equipment regulations)",,GL7 1LF,,40036477,HOFRMWA006,Project
Defra,EA,04/04/2013,Fleet,WA Capital WiP,Mitsubishi Motors,1170987,"£25,297.06","Vehicle Purchase - Commercial Vehicles - Light & Medium Duty 4x4s (Mitsubishi) part of annual fleet asset replacement programme. This is to ensure we operate assets that are both cost effective, safe and legal to use under the PUWER regulations. (provision and use of work equipment regulations)",,GL7 1LF,,40036477,HOEPWA0003,Project
Defra,EA,04/04/2013,Fleet,HO Capital WiP,Mitsubishi Motors,1171601,"£25,918.58","Vehicle Purchase - Commercial Vehicles - Light & Medium Duty 4x4s (Mitsubishi) part of annual fleet asset replacement programme. This is to ensure we operate assets that are both cost effective, safe and legal to use under the PUWER regulations. (provision and use of work equipment regulations)",,GL7 1LF,,30361840,HOFOEP0007,Project
Defra,EA,04/04/2013,Fleet,HO Capital WiP,Mitsubishi Motors,1171610,"£25,338.02","Vehicle Purchase - Commercial Vehicles - Light & Medium Duty 4x4s (Mitsubishi) part of annual fleet asset replacement programme. This is to ensure we operate assets that are both cost effective, safe and legal to use under the PUWER regulations. (provision and use of work equipment regulations)",,GL7 1LF,,30361840,HOFOWR0007,Project
Defra,EA,04/04/2013,Fleet,HO Capital WiP,Mitsubishi Motors,1171620,"£25,338.02","Vehicle Purchase - Commercial Vehicles - Light & Medium Duty 4x4s (Mitsubishi) part of annual fleet asset replacement programme. This is to ensure we operate assets that are both cost effective, safe and legal to use under the PUWER regulations. (provision and use of work equipment regulations)",,GL7 1LF,,30361840,HOFOWR0007,Project
Defra,EA,04/04/2013,Fleet,HO Capital WiP,Mitsubishi Motors,1171634,"£25,338.02","Vehicle Purchase - Commercial Vehicles - Light & Medium Duty 4x4s (Mitsubishi) part of annual fleet asset replacement programme. This is to ensure we operate assets that are both cost effective, safe and legal to use under the PUWER regulations. (provision and use of work equipment regulations)",,GL7 1LF,,30361840,HOFOEP0007,Project
Defra,EA,04/04/2013,Fleet,HO Capital WiP,Mitsubishi Motors,1171640,"£25,345.51","Vehicle Purchase - Commercial Vehicles - Light & Medium Duty 4x4s (Mitsubishi) part of annual fleet asset replacement programme. This is to ensure we operate assets that are both cost effective, safe and legal to use under the PUWER regulations. (provision and use of work equipment regulations)",,GL7 1LF,,30361840,HOFOFI0007,Project
Defra,EA,04/04/2013,Fleet,HO Capital WiP,Mitsubishi Motors,1171647,"£25,651.85","Vehicle Purchase - Commercial Vehicles - Light & Medium Duty 4x4s (Mitsubishi) part of annual fleet asset replacement programme. This is to ensure we operate assets that are both cost effective, safe and legal to use under the PUWER regulations. (provision and use of work equipment regulations)",,GL7 1LF,,30361840,HOFOFI0007,Project
Defra,EA,04/04/2013,Fleet,HO Capital WiP,Mitsubishi Motors,1171651,"£25,651.85","Vehicle Purchase - Commercial Vehicles - Light & Medium Duty 4x4s (Mitsubishi) part of annual fleet asset replacement programme. This is to ensure we operate assets that are both cost effective, safe and legal to use under the PUWER regulations. (provision and use of work equipment regulations)",,GL7 1LF,,30361840,HOFOEP0007,Project
Defra,EA,04/04/2013,Fleet,HO Capital WiP,Mitsubishi Motors,1171655,"£25,679.63","Vehicle Purchase - Commercial Vehicles - Light & Medium Duty 4x4s (Mitsubishi) part of annual fleet asset replacement programme. This is to ensure we operate assets that are both cost effective, safe and legal to use under the PUWER regulations. (provision and use of work equipment regulations)",,GL7 1LF,,30361840,HOFOWR0007,Project
Defra,EA,04/04/2013,Fleet,HO Capital WiP,Mitsubishi Motors,1171743,"£25,049.11","Vehicle Purchase - Commercial Vehicles - Light & Medium Duty 4x4s (Mitsubishi) part of annual fleet asset replacement programme. This is to ensure we operate assets that are both cost effective, safe and legal to use under the PUWER regulations. (provision and use of work equipment regulations)",,GL7 1LF,,30361840,HOFOEP0007,Project
Defra,EA,18/04/2013,ICT Commodities,CI SD Management MRA,Oracle Corporation UK Ltd,1175650,"£123,463.41",Additional Oracle software support for 6th April 2013 to 5th April 2015,,RG6 1RA,,,,Project
Defra,EA,25/04/2013,ICT Commodities,National Enforcement Service,Airwave Solutions Ltd,1177987,"£33,448.60",Direct Basic Communications equipment and airtime service.  The handsets/desktops will be used by Enforcement Officers. 9/11/12 - 8/2/13.,,SL1 2EJ,,30337797,HOOP000051,Project
Defra,EA,25/04/2013,ICT Commodities,National Enforcement Service,Airwave Solutions Ltd,1177990,"£33,448.60",Direct Basic communications equipment and airtime service.  The handsets/desktops will be used by Enforcement Officers. 9/2/13 - 8/5/13.,,SL1 2EJ,,30337797,HOOP000051,Project
Defra,EA,02/04/2013,ICT Commodities,CI SD Management MRA,Scisys UK Ltd,1169218,"£33,120.00",Annual Security & Peneration testing for Carbon Reduction Commitment system,,SN14 0GB,,,,Project
Defra,EA,16/04/2013,ICT Commodities,HO Flood Warning Systems,Teleperformance Ltd,1174556,"£61,495.61",Call centre & management costs for Floodline live agent and Recorded messaging service,,BS1 3LG,,30146474,,Administration
Defra,EA,16/04/2013,ICT Commodities,CI SD Management MRA,Can Studios Ltd,1174728,"£25,909.01",Hosting Agreement,,S1 2BX,,30312649,,Administration
Defra,EA,04/04/2013,ICT Commodities,CI SD Management MRA,Scisys UK Ltd,1171353,"£210,062.10",Carbon Reduction Commitment Support from April 1st 2013 - 31st March 2014,,SN14 0GB,,30331349,,Project
Defra,EA,23/04/2013,ICT Commodities,HO Geomatics,Stone Computer Ltd,1176223,"£69,745.88","Workstations, Hewlett-Packard Servers & 'Quality Network Appliance Provider' Servers",,ST18 9AA,,,,Administration
Defra,EA,18/04/2013,ICT Commodities,CI SD Management MRA,Oracle Corporation UK Ltd,1175485,"£2,180,230.77",Oracle Support Services for all Information Technology systems,,RG6 1RA,,,,Project
Defra,EA,04/04/2013,ICT Commodities,CI Solutions Delivery Management,Epimorphics Ltd,1169345,"£68,304.00",Provision of a Water Framework Directive Linked Data Proof of Concept  Delivery of Beta Version Milestone 2,,BS20 6PT,,30333216,BBPDM20043L04,Project
Defra,EA,02/04/2013,ICT Commodities,CI SD Management MRA,HR Wallingford Ltd,1169108,"£49,968.00",Provision of Year 2 Support & Maintenance Contract for Modelling and Decision Support Framework tools,,OX10 8BA,,,,Administration
Defra,EA,04/04/2013,ICT Commodities,CI SD Management MRA,Scottish Environmental Protection Agency,1167417,"£121,000.00",Support and Maintenance for the application River Invertebrate Classification Tool,,FK9 4TR,,,,Project
Defra,EA,09/04/2013,ICT Commodities,HO Geomatics,Kelway UK Ltd,1173002,"£35,400.00",Support and Maintenance of the Geomatics Network,,EC4M 7RB,,30375341,,Administration
Defra,EA,04/04/2013,ICT Systems,CI Solutions Delivery Management | Nat Trading and Reg Services,Scisys UK Ltd,1167563,"£89,103.60",Carbon Reduction Commitment Simplification & Enhancement Analysis,,SN14 0GB,,30331349, | EBOCC40039L01 | ,Project
Defra,EA,25/04/2013,ICT Systems,HO Capital WiP,Amtec Consulting Plc,1177685,"£35,628.00",Climate Change Agreement Project,,GU9 7HX,,,EBOCC40027L02,Project
Defra,EA,09/04/2013,ICT Systems,E and B Regulated Industry,Scisys UK Ltd,1172154,"£59,953.20",EQual Programme  Definition of Waste Web Tool,,SN14 0GB,,30367342,EBPRI11112L01,Project
Defra,EA,04/04/2013,ICT Systems,CI SD Management MRA,CEFAS,1167973,"£39,900.00",Live fish movements database hosting & support ,,NR33 0HT,,,,Administration
Defra,EA,04/04/2013,ICT Systems,Nat Trading and Reg Services,Solution 7 Ltd,1169326,"£53,550.00",National Packaging Waste Database development,,OX4 4GA,,,EBORI40056L01,Project
Defra,EA,09/04/2013,ICT Systems,CIS Capital WiP | HO Capital WiP,Scisys UK Ltd,1171899,"£275,522.09",Permitting Release 2 Milestone Payments.,,SN14 0GB,,30301794,CIS330865 | EBCRI11502L01,Project
Defra,EA,02/04/2013,Industrial Services,SE West Thames - AEM East,Land & Water Services Ltd,1169178,"£66,379.39",Braywick Fish Pass Project,,GU5 9AF,,30357321,RESE000132,Project
Defra,EA,02/04/2013,Industrial Services,Asset Management Manager,HR Wallingford Ltd,1170110,"£26,400.00",Consultancy Services - Estimating the benefits of Conveyance for different funding scenarios,,OX10 8BA,,,FCPAM00005B04,Project
Defra,EA,09/04/2013,Industrial Services,Head of Research,Construction Industry Research & Information Association,1171994,"£30,000.00",Designing for exceedance project,,EC1V 9BP,,,HOEV101103,Project
Defra,EA,02/04/2013,Industrial Services,"Head of Monitoring, Analysis & Innovation | E and B Land and Water",MWH UK Ltd,1170563,"£47,993.35",Monitoring and Assessment of Environmental Impacts of Droughts Project,,WA3 6GD,,, | EBPLW12036 |  | ,Project
Defra,EA,02/04/2013,Industrial Services,SE Capital WiP,Port Of London Authority,1170263,"£77,750.58",Partial reimbursement of Port of London Authority costs (under section 49 of the Thames Barrier & Flood Protection Act 1972) for Blackwall Stairs Radar Transceivers Replacement,,DA12 2BG,,,IMTH000608,Project
Defra,EA,04/04/2013,Industrial Services,Head of Research,HaskoningDHV UK Ltd,1171290,"£60,000.00",Shore Sensitivity to Accelerating Sea level Rise Project,,PE3 8DW,,,HOEV101103,Project
Defra,EA,11/04/2013,Industrial Services,SE Kent & South London- Tidal Flood Risk Manager,Port Of London Authority,1173465,"£73,182.94",Thames Barrier Running Costs for 2013.,,DA12 2BG,,,,Administration
Defra,EA,25/04/2013,Learning and Development,Asset Management Manager,Brightwave Ltd,1177456,"£41,107.50",Delivery of Nine priority e-learning modules and Workshop ,,BN1 9TE,,30360391,FCPAM00004B00,Project
Defra,EA,16/04/2013,Learning and Development,HR Ops (HO),JCA Occupational Psychologist Ltd,1174095,"£114,364.99","Leadership Development Programme (reports, training, delivery, workbooks, course materials)",,GL50 3DA,,30364110,,Administration
Defra,EA,04/04/2013,Operational Goods,National Enforcement Service,Post Office Ltd,1172141,"£253,914.82",Sale of rod fishing licences and provision of associated services,,PE4 5PG,,30180918,,Administration
Defra,EA,01/04/2013,Personnel Related,HR Strategy,Edenred Childcare Vouchers Ltd,1161189,"£215,596.03",Childcare Assistance scheme March 2013. This money is reclaimed through Salary Sacrifice from the employee on a monthly basis so the scheme is cost neutral,,SW1V 2RS,,,,Administration
Defra,EA,04/04/2013,Personnel Related,HR Strategy,Edenred Childcare Vouchers Ltd,1172786,"£216,247.30",Childcare Assistance scheme April 2013. This money is reclaimed through Salary Sacrifice from the employee on a monthly basis so the scheme is cost neutral,,SW1V 2RS,,,,Administration
Defra,EA,16/04/2013,Personnel Related,Internal Transformation (National),IOM Consulting Ltd,1172771,"£36,931.20",Occupational Hygiene Consultancy,,EH14 4AP,,30158477,,Administration
Defra,EA,25/04/2013,Professional Services - CCL,Economics & Social Science,AMEC Environment & Infrastructure UK Ltd,1177292,"£72,854.90",Illegal waste activities & market benefits of water quality improvements. Economics & Social Science Fasttrack Projects ,,NE3 3PX,,30249220,HOEV121308,Project
Defra,EA,11/04/2013,Professional Services - CCL,National Facilities Manager,Interserve FM Ltd,1158520,"£67,175.28",Mobilisation costs for Facilities Management brought in services,,BS32 4NH,,30365648,,Administration
Defra,EA,04/04/2013,Professional Services Other,Nat Trading and Reg Services,Health & Safety Laboratory,1171422,"£56,520.00",Analysis of suspected non-compliant imported fireworks,,SK17 9JN,,,,Project
Defra,EA,04/04/2013,Professional Services Other,MI Planning and Performance,Longdin & Browning Surveys Ltd,1171665,"£26,508.00",Anglian Coastal Monitoring Programme - Topographic Services,,SA1 1HE,,30352200,REMI001537,Project
Defra,EA,23/04/2013,Professional Services Other,AN Nthn - FCRM Ops (W&N),P & R Plant Lincolnshire Ltd,1176275,"£35,062.80",Anglian-Minor Watercourse Maintenance Works Welland & Nene ,,PE12 8NG,,30258388,FRA01S217,Project
Defra,EA,02/04/2013,Professional Services Other,Head of Research,Jeremy Benn Associates Ltd,1170755,"£52,800.00",Aquatic & Riparian Plant Management  Controls for vegetation in Watercourses.,,BD23 3AE,,30350407,HOEV101103,Project
Defra,EA,04/04/2013,Professional Services Other,NW Ambition Project Manager,Keep Britain Tidy,1171419,"£54,000.00",Better bathing waters  Sefron project ,,WN3 4EX,,,RENW002030,Project
Defra,EA,16/04/2013,Professional Services Other,AN Eastern-AEM - Monitoring,Gelder Ltd,1174261,"£34,661.70",Building Maintenance - carry out installation of door access system Anglian Region,,LN1 2DS,,30199819,REAN000470,Project
Defra,EA,02/04/2013,Professional Services Other,AN Eastern-AEM - Monitoring,Jacobs LES Ltd,1170912,"£47,257.14","Building support, Maintenance & repair services Wixow Pump",,RG41 5TU,,30231597,REAN000470,Project
Defra,EA,09/04/2013,Professional Services Other,SE KSL - FCRM Ops South,Knowlton & Newman Portsmouth Ltd,1172798,"£34,700.40",Butterfly pumping station Supply & install a new panel & station electrical system.,,PO3 5RQ,,30372389,FRA12S071,Project
Defra,EA,02/04/2013,Professional Services Other,AN Capital WiP,Jacobs LES Ltd,1169697,"£58,800.00","Chapel New Refurbishment costs for Generator Cabling, Gearbox, Weedscreen Gearbox and Civils. ",,RG41 5TU,,30312230,IMAN002135,Project
Defra,EA,02/04/2013,Professional Services Other,AN Capital WiP,Jacobs LES Ltd,1169693,"£118,488.00",Civil Works for Chapel St Leonard New Pump Station,,RG41 5TU,,30231597,IMAN002135,Project
Defra,EA,23/04/2013,Professional Services Other,Nat Trading and Reg Services,Ricardo AEA Ltd,1175882,"£54,014.40",Climate Change Agreements Administration Consultancy,,OX11 0QJ,,30372742,,Project
Defra,EA,25/04/2013,Professional Services Other,AN Eastern- FCRM Ops (Essex),Jacobs LES Ltd,1172787,"£114,015.60",Colne  Holland Haven Sluice Refurbishment ,,RG41 5TU,,30231664,FRA04S019,Project
Defra,EA,02/04/2013,Professional Services Other,Head of Research,Newcastle University,1170502,"£26,057.77",Consultancy Mitigation of pollution from abandoned metal mines,,NE1 7RU,,,HOEV101101,Project
Defra,EA,09/04/2013,Professional Services Other,MI Planning and Performance,Birmingham City Council,1172043,"£66,192.80",Contribution to Platt Brook Project,,B1 1BB,,,REMI001776,Project
Defra,EA,09/04/2013,Professional Services Other,SE North East Thames - AEM East,Wildfowl & Wetlands Trust,1172575,"£80,000.00",Contributioon to Sustainable Drainage Systems for school project,,GL2 7BT,,,RESE000334,Project
Defra,EA,11/04/2013,Professional Services Other,NE North East Area Reservoir Op Agreement,Northumbrian Water,1173781,"£605,496.00",Cow Green Reservoir Operating Agreement,,DH1 9WF,,,,Administration
Defra,EA,11/04/2013,Professional Services Other,"Data Mapping, Modelling & Information",Gabriel Information Solutions Ltd,1173128,"£46,898.28",Data Flow Mapping.,,EX1 3SD,,30351044,HOEV101110,Project
Defra,EA,11/04/2013,Professional Services Other,"Data Mapping, Modelling & Information",Gabriel Information Solutions Ltd,1173130,"£32,372.32",DataShare Implementation.,,EX1 3SD,,30351044,,Administration
Defra,EA,11/04/2013,Professional Services Other,SE LE Strategic Env Planning Mgr,Groundwork London,1172922,"£60,000.00",design & install a rain garden into the Renfrew Estate,,SE1 7Q7 | SE1 7QZ,,,RESE000030,Project
Defra,EA,09/04/2013,Professional Services Other,SE KSL - FCRM Ops South,Land & Water Services Ltd,1172054,"£25,527.31",De-silting works (Dover),,GU5 9AF,,30343164,FRA12S076,Project
Defra,EA,09/04/2013,Professional Services Other,SE SSD - FCRM Ops (West),Knowlton & Newman Portsmouth Ltd,1172050,"£26,319.97",Electrical works at Monkton Mead Pump Station Isle of Wight,,PO3 5RQ,,30348247,RESOA10015 | RESEA10005,Project
Defra,EA,04/04/2013,Professional Services Other,AN Eastern-AEM - Monitoring,Essex Wildlife Trust,1168834,"£32,018.00",Essex Water Framework Directive walkover Survey,,C05 7RZ,,,REAN001707,Project
Defra,EA,04/04/2013,Professional Services Other,NW Ambition Project Manager,Keep Britain Tidy,1171989,"£54,000.00",Fylde Beach Care Community Engagement Programme,,WN3 4EX,,,RENW002037,Project
Defra,EA,02/04/2013,Professional Services Other,NE North East Area AEM North,NERC,1170123,"£34,048.86",Geological Mapping and Modelling ,,SN2 1EU,,30176081,RENE430030,Project
Defra,EA,09/04/2013,Professional Services Other,HO Geomatics,Longdin & Browning Surveys Ltd,1172693,"£29,387.15",Geomatics Global Navigation Satellite Systems Service,,SA1 1HE,,,SCLI0001,Project
Defra,EA,09/04/2013,Professional Services Other,SE Capital WiP,RSPB,1171169,"£170,986.80","Great Bells Farm; habitat design, construction and management ",,SG19 2DL,,,IMSO001040,Project
Defra,EA,11/04/2013,Professional Services Other,NE Capital WiP,Northern Archaelogical Associates,1173358,"£41,024.23",Greatham Managed Realignment,,DL12 8BN,,,IMNE000823,Project
Defra,EA,25/04/2013,Professional Services Other,SE NET - FCRM Ops East,Land & Water Services Ltd,1172742,"£93,484.37",Heavy River Maintenance Dredging works (South East),,GU5 9AF,,30343164,RESE500008,Project
Defra,EA,02/04/2013,Professional Services Other,HO Capital WiP,Hydrock Consultants Ltd,1170774,"£32,504.86",Helpston Groundwater Remediation Project  works,,BS32 4DF,,30177470,HOOP000050,Project
Defra,EA,11/04/2013,Professional Services Other,SE North East Thames - AEM East,Hertfordshire & Middlesex Wildlife Trust,1173695,"£33,000.00",Hertforshire Living Rivers Project ,,AL3 4SN,,,RESE000142,Project
Defra,EA,11/04/2013,Professional Services Other,National Enforcement Service,Her Majestys Revenue & Customs,1169536,"£26,776.14",Information for the prevention & detection of crime,,BN12 4XH,,,,Administration
Defra,EA,11/04/2013,Professional Services Other,MI East- FCRM Ops South,ECS Engineering Services Ltd,1174246,"£32,568.00",Install new covers to River Leen Outfall Culvert.,,NG16 6LE,,30312221,REMI001683,Project
Defra,EA,18/04/2013,Professional Services Other,MI West-AEM - 2,Adler & Allan Ltd,1175266,"£65,166.00","Landowner Liquid Fertilisers, Farley, Much Wenlock",,HG1 1HQ,,30180482,REMI001815,Project
Defra,EA,04/04/2013,Professional Services Other,HO Legal Services,18 Red Lion Court,1168777,"£30,738.00",Legal Fees,,EC4A 3EB,,,HOLG000003,Project
Defra,EA,02/04/2013,Professional Services Other,HO Legal Services,David Brooke,1169575,"£47,704.94",Legal Fees,,LS11 5DL,,,HOLG000003,Project
Defra,EA,09/04/2013,Professional Services Other,SW Capital WiP,May Gurney Ltd,1172526,"£64,800.00",Long Load Pumping Station works,,NR14 8SZ,,30346257,IMSW001908,Project
Defra,EA,09/04/2013,Professional Services Other,E and B Climate Change and Communities,Science & Technology Facilities Council,1172216,"£51,283.20",Maintenance of The UK Climate Projections (UKCO09) website,,SN2 1SZ,,,EBPCC11003,Project
Defra,EA,11/04/2013,Professional Services Other,"Head of Monitoring, Analysis & Innovation",Ricardo AEA Ltd,1173300,"£68,440.20",Making available results from national modelling of particulate PM2.5 reductions under future emission scenarios.,,OX11 0QJ,,,HOEV121307,Project
Defra,EA,02/04/2013,Professional Services Other,Incident Management Manager,Met Office,1170907,"£49,200.00",Met Office Services - Wave Hindcast Phase 2 project,,EX1 3PB,,30324303,FCPIM00046B00,Project
Defra,EA,18/04/2013,Professional Services Other,MI Capital WiP,Balfour Beatty Utility Solutions Ltd,1164973,"£27,000.00",Health & Safety Works to Pontrilas ,,S35 2PH,,30372669,IMMI001248,Project
Defra,EA,04/04/2013,Professional Services Other,MI East- FCRM Ops North | MI West - FCRM Ops,Balfour Beatty Utility Solutions Ltd,1171699,"£78,730.80",Midlands & Anglian - Mechanical & Electrical Maintenance of Field Assets,,S35 2PH,,30372669,REMI000499 | REMI000498,Project
Defra,EA,02/04/2013,Professional Services Other,AN Nthn - FCRM Ops (W&N),PG Wright,1170674,"£29,040.00",Minor maintenance Cross Gate bridge on River Glen,,PE12 9EA,,30258390,FRA01S214,Project
Defra,EA,25/04/2013,Professional Services Other,AN Nthn - FCRM Ops (W&N),P & R Plant Lincolnshire Ltd,1177091,"£31,776.00",Minor maintenance works at Thorpe medows,,PE12 8NG,,30258388,FRA01S134,Project
Defra,EA,11/04/2013,Professional Services Other,E and B Climate Change and Communities,Building Research Establishment Ltd,1173045,"£29,256.00",Modern Built Environment- Knowledge Transfer Network Project,,WD25 9XX,,,EBPCC11003,Project
Defra,EA,04/04/2013,Professional Services Other,National Enforcement Service,OPUS International Consultants,1171534,"£299,477.06",National Site Investigation | Op Durable/Endurance Site Examination  Period ending 8th March 13,,NG5 1AF,,30309577,HOOP000215,Project
Defra,EA,16/04/2013,Professional Services Other,FM Operating Unit - Northern,Boulting Technology,1172391,"£25,560.01",North West - Regional Mechanical & Electrical Maintenance of Fixed Plant & Systems in South & North Area,,WA5 2PL,,30270233,,Administration
Defra,EA,18/04/2013,Professional Services Other,National Enforcement Service,GB Group Plc,1176448,"£37,020.00",On line intelligence Services,,CH4 9GB,,,HOOP000161,Project
Defra,EA,02/04/2013,Professional Services Other,AN Capital WiP,Blom Aerofilms Ltd,1170833,"£46,272.00",Ortho-rectification of aerial photography services,,BS27 3EB,,,IMAN002290,Project
Defra,EA,02/04/2013,Professional Services Other,SE West Thames - Plan & Corp Services,Canal & River Trust,1170786,"£39,239.95",Peartree bottom culvert feasibility study,,LS9 8PB,,,RESE000290,Project
Defra,EA,09/04/2013,Professional Services Other,SE North East Thames - AEM East,Land & Water Services Ltd,1172736,"£49,846.86",Pennywort Removal River Colne,,GU5 9AF,,30343164,RESE000334,Project
Defra,EA,11/04/2013,Professional Services Other,E and B Land and Water,Phoslock Water Solutions UK Ltd,1172239,"£71,432.25",Phoslock treatment of the Mere & Hatchmere ,,EI4 9DB,,,EBPLW12055,Project
Defra,EA,02/04/2013,Professional Services Other,SW Wessex - FCRM,Lewis Brown Ltd,1170015,"£29,776.80",Professional fees for Topographical Surveys for Embankment Surveys.,,TA21 9JQ,,,RESW001063,Project
Defra,EA,18/04/2013,Professional Services Other,NE Yorkshire - FCRM Ops N&EY,Amco Engineering,1175654,"£42,004.88",Project work on fixed plant system Yorkshire North,,S75 1HT,,30244069,RENE790106,Project
Defra,EA,18/04/2013,Professional Services Other,NE Yorkshire - FCRM Ops N&EY,Amco Engineering,1175651,"£49,181.98",Project work on fixed plant system Yorkshire South,,S75 1HT,,30244069,RENE790106,Project
Defra,EA,18/04/2013,Professional Services Other,SE WT - FCRM Ops (North West),Cleartrack EVL Ltd,1175573,"£31,392.00",Reactive watercourse tree works on the River Thames from St John's Lock to Whitchurch Lock Site ,,TN27 9PG,,30343161,FRA15S180 | FRA15S181 | FRA15S184 | FRA15S177 | FRA15S185 | FRA15S178 | FRA15S182 | FRA15S183 | FRA15S179,Project
Defra,EA,18/04/2013,Professional Services Other,Nat Trading and Reg Services,Northern Ireland Environment Agency,1176168,"£31,895.00","Recharge between Northern Ireland Environment Agency and Environment Agency for Producer Responsibilty: Packaging, Batteries, Waste Electronic and Electrical Equipment (WEEE)",,BT1 4NN,,,,Administration
Defra,EA,02/04/2013,Professional Services Other,AN Capital WiP,Jacobs LES Ltd,1169695,"£56,688.00",Refurbishment of 1000mm Axial Flow Pump including Gearbox,,RG41 5TU,,30231597,IMAN002135,Project
Defra,EA,16/04/2013,Professional Services Other,FM Operating Unit - Northern,Boulting Technology,1174438,"£25,560.01",Regional Mechanical & Electrical Maintenance of Fixed Plant & Systems in South & North Area,,WA5 2PL,,30270233,,Administration
Defra,EA,18/04/2013,Professional Services Other,AN Nthn - FCRM Ops (W&N),PG Wright,1175020,"£27,480.00","Remedial works to bridge structures Welland, Nene & Lincolnshire. Stapleford Digby",,PE12 9EA,,30258390,REAN001207,Project
Defra,EA,04/04/2013,Professional Services Other,WA South East-AEM - East,Acumen Waste Services Ltd,1172443,"£168,240.00",Removal of food waste from an abandoned waste facility in Caerwent.,,WF11 0LA,,40028067,REWA000726,Project
